{
  "schema_version": "hetero-sim/v1",
  "experiment": {"name": "m8_model3_full_runtime_reference", "seed": 1, "generation_mode": "trace_locked"},
  "simulation": {"coupling": "request_cycle", "execution_mode": "full_runtime", "validation_policy": "deferred"},
  "system": {
    "profile": "model3_gpu_native_3ddram",
    "links": {
      "shared3d.explicit_noncoherent": {
        "wire_bandwidth_Bps": 409600000000,
        "latency_fs": 1000000,
        "header_bytes": 0,
        "resource_id": "shared3d.sync",
        "parameter_source": "reference_unqualified",
        "queue_depth_transactions": 64,
        "credits": 64,
        "full_duplex": true,
        "protocol": "explicit_noncoherent"
      }
    },
    "memory_services": {
      "shared0.dram3d": {
        "kind": "shared_3d_reference",
        "timing_owner": "shared3d.memory_service",
        "channel_count": 16,
        "banks_per_channel": 16,
        "transaction_bytes": 64,
        "queue_depth_per_initiator": 64,
        "fixed_latency_fs": 100000000,
        "channel_injection_interval_fs": 1000000,
        "bank_busy_time_fs": 5000000,
        "initiator_order": ["gpu0", "atlas0.compute"],
        "parameter_source": "reference_unqualified"
      }
    }
  },
  "backends": {
    "gpu": {"kind": "roofline", "effective_compute_flops_per_s": 100000000000000, "effective_memory_bandwidth_Bps": 1000000000000, "parameter_source": "reference_unqualified"},
    "atlas": {"kind": "analytical", "effective_compute_flops_per_s": 10000000000000, "effective_memory_bandwidth_Bps": 409600000000, "parameter_source": "reference_unqualified"},
    "host": {"kind": "none"}
  },
  "model": {"ref": "configs/hetero/models/tiny_llama_2layer.json"},
  "workload": {"ref": "configs/hetero/workloads/ragged_continuous.json"},
  "scheduling": {"ref": "configs/hetero/schedulers/continuous_mixed.json"},
  "placement": {"ref": "configs/hetero/placements/gpu_prefill_atlas_decode.json"},
  "address": {"ref": "configs/hetero/addresses/paged_kv_tiny.json"},
  "metrics": {"ref": "configs/hetero/metrics/e2e_validation.json"}
}
