{
  "schema_version": "hetero-sim/v1",
  "experiment": {"name": "m8_opt67b_rtx4090_roofline", "seed": 1, "generation_mode": "trace_locked"},
  "simulation": {"coupling": "analytical", "execution_mode": "analytical_preview", "validation_policy": "deferred"},
  "system": {
    "profile": "model3_gpu_native_3ddram",
    "links": {
      "shared3d.explicit_noncoherent": {
        "wire_bandwidth_Bps": 1008000000000,
        "latency_fs": 0,
        "header_bytes": 0,
        "resource_id": "unused_gpu_only_route",
        "parameter_source": "NVIDIA_Ada_whitepaper_theoretical",
        "queue_depth_transactions": 64,
        "credits": 64,
        "full_duplex": true,
        "protocol": "unused_gpu_only"
      }
    }
  },
  "backends": {
    "gpu": {
      "kind": "roofline",
      "effective_compute_flops_per_s": 330300000000000,
      "effective_memory_bandwidth_Bps": 1008000000000,
      "parameter_source": "NVIDIA_RTX4090_theoretical_dense_fp16_and_memory_bandwidth"
    },
    "atlas": {
      "kind": "analytical",
      "effective_compute_flops_per_s": 10000000000000,
      "effective_memory_bandwidth_Bps": 409600000000,
      "parameter_source": "unused_reference"
    },
    "host": {"kind": "none"}
  },
  "model": {"ref": "configs/hetero/models/opt_6_7b_fp16.json"},
  "workload": {"ref": "configs/hetero/workloads/opt67b_bs1_ctx1024_single_decode.json"},
  "scheduling": {
    "mode": "static_ragged",
    "max_num_sequences": 1,
    "max_batched_tokens": 1024,
    "prefill_chunk_tokens": 1024,
    "max_prefill_wait_epochs": 8,
    "epoch_duration_fs": 1000
  },
  "placement": {"ref": "configs/hetero/placements/gpu_only.json"},
  "address": {
    "allocator": "first_fit",
    "page_tokens": 16,
    "kv_capacity_bytes": 25769803776,
    "allocation_alignment_bytes": 256
  },
  "metrics": {"ref": "configs/hetero/metrics/e2e_validation.json"}
}
