{
  "schema_version": "hetero-sim/v1",
  "experiment": {
    "name": "p24_tinyllama_1layer_kv_pressure_bs4",
    "seed": 1,
    "generation_mode": "replayed_eos"
  },
  "simulation": {
    "coupling": "request_cycle",
    "execution_mode": "scheduler_validation",
    "validation_policy": "required"
  },
  "system": {"profile": "model3_gpu_native_3ddram"},
  "backends": {
    "gpu": {"kind": "roofline"},
    "atlas": {"kind": "none"},
    "host": {"kind": "none"}
  },
  "model": {"ref": "configs/hetero/models/tinyllama_1_1b_decode_1layer_fp16.json"},
  "workload": {"ref": "configs/hetero/workloads/p24_kv_pressure_reuse_bs4.json"},
  "scheduling": {"ref": "configs/hetero/schedulers/p24_kv_pressure_bs4.json"},
  "placement": {"ref": "configs/hetero/placements/gpu_only.json"},
  "address": {"ref": "configs/hetero/addresses/p24_paged_kv_capacity_32k.json"},
  "metrics": {"ref": "configs/hetero/metrics/e2e_validation.json"}
}
